{"$schema":"https://json-schema.org/draft/2020-12/schema","$id":"urn:aicontrolcenter:governance:v1:execution-receipt","title":"GovernanceExecutionReceipt","type":"object","additionalProperties":false,"required":["schema_version","receipt_id","lifecycle_id","execution_request_id","authorization_id","claim_id","mutation_budget_id","action_type","status","actual_invocation_count","completed_count","uncertain_count","started_at","completed_at","result_digest","reason_codes"],"properties":{"schema_version":{"const":"governance/v1"},"receipt_id":{"$ref":"#/$defs/text"},"lifecycle_id":{"$ref":"#/$defs/text"},"execution_request_id":{"$ref":"#/$defs/text"},"authorization_id":{"$ref":"#/$defs/text"},"claim_id":{"$ref":"#/$defs/text"},"mutation_budget_id":{"$ref":"#/$defs/text"},"action_type":{"$ref":"#/$defs/action"},"status":{"enum":["COMPLETED","FAILED","UNCERTAIN"]},"actual_invocation_count":{"type":"integer","minimum":0},"completed_count":{"type":"integer","minimum":0},"uncertain_count":{"type":"integer","minimum":0},"started_at":{"type":"string","format":"date-time"},"completed_at":{"oneOf":[{"type":"string","format":"date-time"},{"type":"null"}]},"result_digest":{"$ref":"#/$defs/nullableText"},"reason_codes":{"type":"array","uniqueItems":true,"items":{"$ref":"#/$defs/code"}}},"$defs":{"text":{"type":"string","minLength":1},"nullableText":{"oneOf":[{"$ref":"#/$defs/text"},{"type":"null"}]},"code":{"type":"string","pattern":"^[A-Z][A-Z0-9]*(?:_[A-Z0-9]+)*$"},"action":{"type":"string","pattern":"^[A-Z][A-Z0-9]*(?:[_:.][A-Z0-9]+)+$","not":{"enum":["ACTION","EXECUTE","MUTATE","WRITE"]}}}}
