{"schema_version":"governance/v1","receipt_id":"execution-receipt-synthetic-001","lifecycle_id":"lifecycle-synthetic-001","execution_request_id":"execution-request-synthetic-001","authorization_id":"authorization-synthetic-001","claim_id":"claim-synthetic-001","mutation_budget_id":"budget-synthetic-001","action_type":"DOCS:UPDATE","status":"COMPLETED","actual_invocation_count":1,"completed_count":1,"uncertain_count":0,"started_at":"2026-08-10T00:04:00+00:00","completed_at":"2026-08-10T00:05:00+00:00","result_digest":"digest-result-synthetic-001","reason_codes":[]}
